{
  "schemaVersion": "1.0.0",
  "language": {
    "source": "en",
    "translation": "zh-Hans"
  },
  "sourceTitle": "Kelly Nail School — NAILS (EN) 2026",
  "generatedAt": "2026-09-19T00:00:00.000Z",
  "releaseState": "active",
  "statistics": {
    "total": 89
  },
  "questions": [
    {
      "id": "kelly-001",
      "questionNumber": 1,
      "type": "multiple-choice",
      "question": {
        "en": "The living skin at the base of the nail plate is called the:",
        "zh": "甲板根部的活皮肤称为什么？"
      },
      "choices": [
        {
          "id": "a",
          "en": "Eponychium, located at the base of the nail near the lunula",
          "zh": "甲上皮，位于靠近甲半月的甲根处"
        },
        {
          "id": "b",
          "en": "Hyponychium",
          "zh": "甲下皮"
        },
        {
          "id": "c",
          "en": "Nail bed",
          "zh": "甲床"
        },
        {
          "id": "d",
          "en": "Cushion tissue",
          "zh": "软垫组织"
        }
      ],
      "correctChoice": "a",
      "textOrigin": "source",
      "choicesOrigin": "source",
      "status": "approved",
      "source": {
        "photos": [
          "IMG_4345.JPG",
          "IMG_4452.JPG"
        ],
        "answerSource": "domain-knowledge",
        "auditNote": "IMG_4345 text verified; A textbook."
      },
      "verification": {
        "questionChecked": true,
        "choicesChecked": true,
        "answerKeyChecked": true,
        "translationChecked": true
      }
    },
    {
      "id": "kelly-002",
      "questionNumber": 2,
      "type": "multiple-choice",
      "question": {
        "en": "Massage is usually performed:",
        "zh": "按摩通常在什么时候进行？"
      },
      "choices": [
        {
          "id": "a",
          "en": "After applying treatment products",
          "zh": "涂抹护理产品之后"
        },
        {
          "id": "b",
          "en": "Before trimming nails",
          "zh": "修剪指甲之前"
        },
        {
          "id": "c",
          "en": "After applying color polish",
          "zh": "涂彩色甲油之后"
        },
        {
          "id": "d",
          "en": "After using an electric file",
          "zh": "使用电动磨甲机之后"
        }
      ],
      "correctChoice": "a",
      "textOrigin": "source",
      "choicesOrigin": "source",
      "status": "approved",
      "source": {
        "photos": [
          "IMG_4346.JPG"
        ],
        "answerSource": "domain-knowledge",
        "auditNote": "IMG_4346; D restored from vision."
      },
      "verification": {
        "questionChecked": true,
        "choicesChecked": true,
        "answerKeyChecked": true,
        "translationChecked": true
      }
    },
    {
      "id": "kelly-003",
      "questionNumber": 3,
      "type": "multiple-choice",
      "question": {
        "en": "Which tool is used to clean fingernails or toenails before a service?",
        "zh": "服务前用什么工具清洁手指甲或脚趾甲？"
      },
      "choices": [
        {
          "id": "a",
          "en": "Nail brush",
          "zh": "甲刷"
        },
        {
          "id": "b",
          "en": "Gel brush",
          "zh": "凝胶刷"
        },
        {
          "id": "c",
          "en": "Nail clippers",
          "zh": "指甲剪"
        },
        {
          "id": "d",
          "en": "Nail file",
          "zh": "磨甲锉"
        }
      ],
      "correctChoice": "a",
      "textOrigin": "source",
      "choicesOrigin": "source",
      "status": "approved",
      "source": {
        "photos": [
          "IMG_4347.JPG",
          "IMG_4502.JPG"
        ],
        "answerSource": "domain-knowledge",
        "auditNote": "IMG_4347; D=Nail file."
      },
      "verification": {
        "questionChecked": true,
        "choicesChecked": true,
        "answerKeyChecked": true,
        "translationChecked": true
      }
    },
    {
      "id": "kelly-004",
      "questionNumber": 4,
      "type": "multiple-choice",
      "question": {
        "en": "If a client's feet show itching, peeling skin, or nail discoloration, it may indicate:",
        "zh": "如果顾客脚部出现瘙痒、脱皮或趾甲变色，可能表示什么？"
      },
      "choices": [
        {
          "id": "a",
          "en": "Nail fungus or athlete's foot",
          "zh": "甲真菌感染或足癣"
        },
        {
          "id": "b",
          "en": "Calluses",
          "zh": "胼胝"
        },
        {
          "id": "c",
          "en": "Polish allergy",
          "zh": "甲油过敏"
        },
        {
          "id": "d",
          "en": "Normal dry skin",
          "zh": "正常皮肤干燥"
        }
      ],
      "correctChoice": "a",
      "textOrigin": "source",
      "choicesOrigin": "source",
      "status": "approved",
      "source": {
        "photos": [
          "IMG_4348.JPG",
          "IMG_4485.JPG"
        ],
        "answerSource": "domain-knowledge",
        "auditNote": "IMG_4348: real on-screen choices recovered (previous entry duplicated 'Nail fungus or athlete's foot' across A/B, dropping 'Calluses'); stem restored in full."
      },
      "verification": {
        "questionChecked": true,
        "choicesChecked": true,
        "answerKeyChecked": true,
        "translationChecked": true
      }
    },
    {
      "id": "kelly-005",
      "questionNumber": 5,
      "type": "multiple-choice",
      "question": {
        "en": "Which of the following is a solvent?",
        "zh": "以下哪一种是溶剂？"
      },
      "choices": [
        {
          "id": "a",
          "en": "Polymer",
          "zh": "聚合物"
        },
        {
          "id": "b",
          "en": "Acetone",
          "zh": "丙酮"
        },
        {
          "id": "c",
          "en": "Resin",
          "zh": "树脂"
        },
        {
          "id": "d",
          "en": "Primer",
          "zh": "底液"
        }
      ],
      "correctChoice": "b",
      "textOrigin": "source",
      "choicesOrigin": "source",
      "status": "approved",
      "source": {
        "photos": [
          "IMG_4349.JPG",
          "IMG_4463.JPG"
        ],
        "answerSource": "domain-knowledge",
        "auditNote": ""
      },
      "verification": {
        "questionChecked": true,
        "choicesChecked": true,
        "answerKeyChecked": true,
        "translationChecked": true
      }
    },
    {
      "id": "kelly-006",
      "questionNumber": 6,
      "type": "multiple-choice",
      "question": {
        "en": "When monomer and polymer are combined, they create:",
        "zh": "单体与聚合物混合后会产生什么？"
      },
      "choices": [
        {
          "id": "a",
          "en": "A chemical reaction",
          "zh": "化学反应"
        },
        {
          "id": "b",
          "en": "A physical mixture only",
          "zh": "仅形成物理混合物"
        },
        {
          "id": "c",
          "en": "Conditioning oil",
          "zh": "护理油"
        },
        {
          "id": "d",
          "en": "Nail polish remover",
          "zh": "卸甲水"
        }
      ],
      "correctChoice": "a",
      "textOrigin": "source",
      "choicesOrigin": "source",
      "status": "approved",
      "source": {
        "photos": [
          "IMG_4350.JPG",
          "IMG_4483.JPG"
        ],
        "answerSource": "domain-knowledge",
        "auditNote": ""
      },
      "verification": {
        "questionChecked": true,
        "choicesChecked": true,
        "answerKeyChecked": true,
        "translationChecked": true
      }
    },
    {
      "id": "kelly-007",
      "questionNumber": 7,
      "type": "multiple-choice",
      "question": {
        "en": "Primer is used to:",
        "zh": "底液的用途是什么？"
      },
      "choices": [
        {
          "id": "a",
          "en": "Add shine",
          "zh": "增加光泽"
        },
        {
          "id": "b",
          "en": "Soften the nail",
          "zh": "软化指甲"
        },
        {
          "id": "c",
          "en": "Improve adhesion",
          "zh": "增强附着力"
        },
        {
          "id": "d",
          "en": "Remove color",
          "zh": "去除颜色"
        }
      ],
      "correctChoice": "c",
      "textOrigin": "source",
      "choicesOrigin": "source",
      "status": "approved",
      "source": {
        "photos": [
          "IMG_4352.JPG"
        ],
        "answerSource": "domain-knowledge",
        "auditNote": ""
      },
      "verification": {
        "questionChecked": true,
        "choicesChecked": true,
        "answerKeyChecked": true,
        "translationChecked": true
      }
    },
    {
      "id": "kelly-008",
      "questionNumber": 8,
      "type": "multiple-choice",
      "question": {
        "en": "Cuticle remover helps to:",
        "zh": "去死皮剂有什么作用？"
      },
      "choices": [
        {
          "id": "a",
          "en": "Soften dead skin",
          "zh": "软化死皮"
        },
        {
          "id": "b",
          "en": "Add shine",
          "zh": "增加光泽"
        },
        {
          "id": "c",
          "en": "Make nails longer",
          "zh": "使指甲变长"
        },
        {
          "id": "d",
          "en": "Disinfect",
          "zh": "消毒"
        }
      ],
      "correctChoice": "a",
      "textOrigin": "source",
      "choicesOrigin": "source",
      "status": "approved",
      "source": {
        "photos": [
          "IMG_4353.JPG",
          "IMG_4476.JPG"
        ],
        "answerSource": "domain-knowledge",
        "auditNote": "IMG_4353: real on-screen choices recovered (previous entry duplicated 'Soften dead skin'/'Make nails longer' across all 4 slots, dropping 'Add shine'/'Disinfect')."
      },
      "verification": {
        "questionChecked": true,
        "choicesChecked": true,
        "answerKeyChecked": true,
        "translationChecked": true
      }
    },
    {
      "id": "kelly-009",
      "questionNumber": 9,
      "type": "multiple-choice",
      "question": {
        "en": "Applying too much primer may cause:",
        "zh": "使用过多底液可能造成什么？"
      },
      "choices": [
        {
          "id": "a",
          "en": "Skin irritation and itching",
          "zh": "皮肤刺激和瘙痒"
        },
        {
          "id": "b",
          "en": "Faster nail growth",